{
  "schema_version": 1,
  "batch_id": "webapp_custom_factors",
  "batch_name": "Web 平台自定义因子",
  "project": "自定义因子",
  "batch_version": 6,
  "generated_at": "2026-07-07T15:38:15+08:00",
  "source": {
    "type": "webapp",
    "name": "Factor evaluation web platform",
    "notes": "User-maintained factor definitions"
  },
  "formula_language": "engine expression",
  "factor_count": 5,
  "factors": [
    {
      "number": 1,
      "factor_name": "worldquant_test1",
      "entered_at": "2026-07-06T14:19:36+08:00",
      "implementation_set": "webapp_custom",
      "expression": "-rank_cs((c/o)-1) * rank_cs(vol / adv(amt,20))",
      "paper_expression": "worldquant 因子测试",
      "required_symbols": [
        "amt",
        "c",
        "o",
        "vol"
      ],
      "uses_proxy": false,
      "proxy_description": ""
    },
    {
      "number": 2,
      "factor_name": "007_fixed",
      "entered_at": "2026-07-07T14:34:43+08:00",
      "implementation_set": "webapp_custom",
      "expression": "where(adv(vol, 20) < vol, ((-1 * ts_rank(abs(delta(c, 7)), 60)) * sign(delta(c, 7))), -1.0)",
      "paper_expression": "",
      "required_symbols": [
        "c",
        "vol"
      ],
      "uses_proxy": false,
      "proxy_description": ""
    },
    {
      "number": 3,
      "factor_name": "worldquant_testfixed_1",
      "entered_at": "2026-07-07T15:10:00+08:00",
      "implementation_set": "webapp_custom",
      "expression": "-rank_cs((c/o)-1) * rank_cs(vol / adv(vol,20))",
      "paper_expression": "",
      "required_symbols": [
        "c",
        "o",
        "vol"
      ],
      "uses_proxy": false,
      "proxy_description": ""
    },
    {
      "number": 4,
      "factor_name": "momentum_test",
      "entered_at": "2026-07-07T15:35:28+08:00",
      "implementation_set": "webapp_custom",
      "expression": "rank_cs(vol / adv(vol,20))",
      "paper_expression": "",
      "required_symbols": [
        "vol"
      ],
      "uses_proxy": false,
      "proxy_description": ""
    },
    {
      "number": 5,
      "factor_name": "price_movement_test",
      "entered_at": "2026-07-07T15:38:15+08:00",
      "implementation_set": "webapp_custom",
      "expression": "-rank_cs(c/o-1)",
      "paper_expression": "",
      "required_symbols": [
        "c",
        "o"
      ],
      "uses_proxy": false,
      "proxy_description": ""
    }
  ]
}
