{
  "schema_version": 1,
  "batch_id": "webapp_factor_library",
  "batch_name": "Web 平台因子库",
  "batch_version": 12,
  "generated_at": "2026-07-22T10:23:14+08:00",
  "source": {
    "type": "webapp",
    "name": "Factor evaluation web platform",
    "notes": "User-submitted production factor definitions"
  },
  "formula_language": "engine expression",
  "factor_count": 1,
  "factors": [
    {
      "number": 6,
      "factor_name": "gp_002",
      "entered_at": "2026-07-22T09:27:36+08:00",
      "updated_at": "2026-07-22T10:15:50+08:00",
      "implementation_set": "submitted",
      "project": "自定义因子",
      "expression": "ts_product((((((0.411430180093) * (vol))) - (h))), 20)",
      "paper_expression": "",
      "required_symbols": [
        "h",
        "vol"
      ],
      "uses_proxy": false,
      "proxy_description": "",
      "submitted_at": "2026-07-22T10:15:50+08:00",
      "source_batch_id": "webapp_test_factors",
      "source_factor_name": "gp_002"
    }
  ]
}
